{
  "module_id": "fixture.rust_importer.c_unsafe_call",
  "layer": "scir_h",
  "source_language": "rust",
  "source_path": "tests/rust_importer/cases/c_unsafe_call/input/src/lib.rs",
  "declared_profiles": [
    "R"
  ],
  "declared_tier": "C",
  "dependencies": [
    "rust:std",
    "capability:unsafe_ping"
  ],
  "exports": [
    "call_unsafe_ping"
  ],
  "opaque_boundary_count": 1
}
